{
  "runtime_approval_policy": {
    "name": "manual-review-runtime-approval/v1",
    "version": "v1",
    "contract_registry_version": "runtime-contracts/v1"
  },
  "required_evidence_artifacts": [
    "runtime_report",
    "runtime_trace_report",
    "runtime_contract_registry",
    "runtime_evidence_manifest"
  ],
  "required_checks": [
    "verify_runtime_evidence_manifest",
    "verify_runtime_approval_policy",
    "human_review_required"
  ],
  "allowed_decisions": [
    "approved",
    "rejected",
    "needs_review",
    "waived"
  ],
  "allowed_check_statuses": [
    "passed",
    "failed",
    "waived",
    "needs_review"
  ],
  "approvers": [
    "policy-owner",
    "human-reviewer"
  ],
  "waiver_rules": {
    "requires_note_or_waived_check": true
  },
  "rejection_rules": {
    "requires_note_or_failed_check": true
  }
}
